{"schema":"fleetflight/counterexample@1","id":"cex-0b2044d5","model":{"name":"core-ref","version":"1.0","hash":"sha256:37085184e8ba"},"sut":{"id":"firmware-ref@v0.3.1","name":"firmware-ref","version":"v0.3.1"},"invariant":{"id":"I4","name":"IDEMPOTENT_COMMANDS","description":"A command (epoch, seq) is applied by the inverter at most once: duplicated or reordered copies never cause a second physical action.","formula":"G( ∀(epoch,seq): applied_count(epoch,seq) ≤ 1 )","bound_ms":null,"timer_key":null},"violated_at_ms":250,"violation_duration_ms":null,"bounds":{"max_depth":120,"max_injections":3,"horizon_ms":4000},"search":{"strategy":"bfs","minimal":true,"depth":7,"states_explored":4073,"transitions":5857,"wall_s":0.1192},"assumptions":["ASSUMED bus latency <= 800 ms; messages may be delayed, dropped, duplicated or reordered","ASSUMED BMS FAULT message is edge-triggered and retransmitted every 100 ms until the hub ACKs it; status heartbeat every 2000 ms","ASSUMED hub boot takes 400 ms and clears its RX buffer; only NVM survives a restart","ASSUMED shutdown budget 500 ms (a real number would come from Base's safety requirements)","ASSUMED one dispatch at t=0: DISCHARGE 5000 W, expires at 3000 ms; cloud re-dispatch after a hub restart is not modeled","ASSUMED network_loss means the hub-inverter link is down for the rest of the run","OUT OF SCOPE hardware interlocks (contactors, hardwired BMS trip)","OUT OF SCOPE core-ref is a reference model we wrote, not Base Gen 3 firmware"],"trace":[{"step":0,"t_ms":0,"move":null,"snapshot":{"t_ms":0,"bms":"HEALTHY","bus":"","hub":"ONLINE e1 seq41 DISCHARGE 5000W","inv":"DISCHARGING 5000W seq41 e1","nvm":"e1 next42 seq41 DISCHARGE 5000W e1","hub_bms":"HEALTHY","link":"UP","inv_basis":"HEALTHY","i1_since_ms":null,"i5_since_ms":null,"i4_repeat":null,"injections_left":3},"events":[]},{"step":1,"t_ms":50,"move":{"name":"tick","args":{},"injected":false,"label":"tick"},"snapshot":{"t_ms":50,"bms":"HEALTHY","bus":"","hub":"ONLINE e1 seq41 DISCHARGE 5000W","inv":"DISCHARGING 5000W seq41 e1","nvm":"e1 next42 seq41 DISCHARGE 5000W e1","hub_bms":"HEALTHY","link":"UP","inv_basis":"HEALTHY","i1_since_ms":null,"i5_since_ms":null,"i4_repeat":null,"injections_left":3},"events":[]},{"step":2,"t_ms":100,"move":{"name":"tick","args":{},"injected":false,"label":"tick"},"snapshot":{"t_ms":100,"bms":"HEALTHY","bus":"cmd@100 hub→inv due 150","hub":"ONLINE e1 seq41 DISCHARGE 5000W","inv":"DISCHARGING 5000W seq41 e1","nvm":"e1 next42 seq41 DISCHARGE 5000W e1","hub_bms":"HEALTHY","link":"UP","inv_basis":"HEALTHY","i1_since_ms":null,"i5_since_ms":null,"i4_repeat":null,"injections_left":3},"events":[{"t_ms":100,"name":"refresh","detail":"cmd@100 CMD hub→inv seq41 DISCHARGE 5000W e1","injected":false}]},{"step":3,"t_ms":100,"move":{"name":"bms_fault","args":{},"injected":true,"label":"bms_fault"},"snapshot":{"t_ms":100,"bms":"FAULTED unacked","bus":"cmd@100 hub→inv due 150; fault@100 bms→hub due 150","hub":"ONLINE e1 seq41 DISCHARGE 5000W","inv":"DISCHARGING 5000W seq41 e1","nvm":"e1 next42 seq41 DISCHARGE 5000W e1","hub_bms":"HEALTHY","link":"UP","inv_basis":"HEALTHY","i1_since_ms":100,"i5_since_ms":null,"i4_repeat":null,"injections_left":2},"events":[{"t_ms":100,"name":"bms_fault","detail":"bms_fault","injected":true},{"t_ms":100,"name":"send","detail":"fault@100 FAULT bms→hub","injected":false}]},{"step":4,"t_ms":100,"move":{"name":"bus_delay","args":{"msg":"cmd@100","extra_ms":100},"injected":true,"label":"bus_delay(msg=cmd@100, extra_ms=100)"},"snapshot":{"t_ms":100,"bms":"FAULTED unacked","bus":"fault@100 bms→hub due 150; cmd@100 hub→inv due 250","hub":"ONLINE e1 seq41 DISCHARGE 5000W","inv":"DISCHARGING 5000W seq41 e1","nvm":"e1 next42 seq41 DISCHARGE 5000W e1","hub_bms":"HEALTHY","link":"UP","inv_basis":"HEALTHY","i1_since_ms":100,"i5_since_ms":null,"i4_repeat":null,"injections_left":1},"events":[{"t_ms":100,"name":"bus_delay","detail":"bus_delay(msg=cmd@100, extra_ms=100)","injected":true},{"t_ms":100,"name":"delayed","detail":"cmd@100 now due 250","injected":false}]},{"step":5,"t_ms":150,"move":{"name":"tick","args":{},"injected":false,"label":"tick"},"snapshot":{"t_ms":150,"bms":"FAULTED unacked","bus":"ack@150 hub→bms due 200; cmd@150 hub→inv due 200; cmd@100 hub→inv due 250","hub":"ONLINE e1 seq42 STOP","inv":"DISCHARGING 5000W seq41 e1","nvm":"e1 next43 seq42 STOP 0W e1","hub_bms":"FAULTED","link":"UP","inv_basis":"HEALTHY","i1_since_ms":100,"i5_since_ms":0,"i4_repeat":null,"injections_left":1},"events":[{"t_ms":150,"name":"deliver","detail":"fault@100 → hub","injected":false},{"t_ms":150,"name":"send","detail":"cmd@150 CMD hub→inv seq42 STOP 0W e1","injected":false},{"t_ms":150,"name":"send","detail":"ack@150 ACK hub→bms","injected":false}]},{"step":6,"t_ms":200,"move":{"name":"tick","args":{},"injected":false,"label":"tick"},"snapshot":{"t_ms":200,"bms":"FAULTED acked","bus":"cmd@100 hub→inv due 250; cmd@200 hub→inv due 250","hub":"ONLINE e1 seq42 STOP","inv":"IDLE seq42 e1","nvm":"e1 next43 seq42 STOP 0W e1","hub_bms":"FAULTED","link":"UP","inv_basis":"FAULTED","i1_since_ms":null,"i5_since_ms":null,"i4_repeat":null,"injections_left":1},"events":[{"t_ms":200,"name":"deliver","detail":"ack@150 → bms","injected":false},{"t_ms":200,"name":"deliver","detail":"cmd@150 → inv","injected":false},{"t_ms":200,"name":"refresh","detail":"cmd@200 CMD hub→inv seq42 STOP 0W e1","injected":false}]},{"step":7,"t_ms":250,"move":{"name":"tick","args":{},"injected":false,"label":"tick"},"snapshot":{"t_ms":250,"bms":"FAULTED acked","bus":"","hub":"ONLINE e1 seq42 STOP","inv":"IDLE seq42 e1","nvm":"e1 next43 seq42 STOP 0W e1","hub_bms":"FAULTED","link":"UP","inv_basis":"FAULTED","i1_since_ms":null,"i5_since_ms":null,"i4_repeat":"e1 seq41","injections_left":1},"events":[{"t_ms":250,"name":"deliver","detail":"cmd@100 → inv","injected":false},{"t_ms":250,"name":"inv_reapply","detail":"inverter applied e1 seq41 again","injected":false},{"t_ms":250,"name":"deliver","detail":"cmd@200 → inv","injected":false},{"t_ms":250,"name":"inv_reapply","detail":"inverter applied e1 seq42 again","injected":false}],"violations":["I4"]}],"moves":[{"tick_index":2,"t_ms":100,"move":{"name":"bms_fault","args":{},"injected":true,"label":"bms_fault"}},{"tick_index":2,"t_ms":100,"move":{"name":"bus_delay","args":{"msg":"cmd@100","extra_ms":100},"injected":true,"label":"bus_delay(msg=cmd@100, extra_ms=100)"}}],"ticks":5,"trace_hash":"sha256:0a3dbee840e196b9984ad27e055f125fa251550e568d03b8a9536f3c84650da5","replay":{"command":"fleetflight replay --counterexample cex-0b2044d5"}}