{"schema":"fleetflight/counterexample@1","id":"cex-6b2a6d1b","model":{"name":"core-ref","version":"1.0","hash":"sha256:37085184e8ba"},"sut":{"id":"firmware-ref@v0.3.1","name":"firmware-ref","version":"v0.3.1"},"invariant":{"id":"I2","name":"NO_HIGH_POWER_WHEN_UNKNOWN","description":"The inverter never runs above 1000 W on a command the hub sent while it had no BMS report since its last boot (BMS state UNKNOWN to the hub).","formula":"G( inv_watts > 1000 → inv_basis ≠ UNKNOWN )","bound_ms":null,"timer_key":null},"violated_at_ms":450,"violation_duration_ms":null,"bounds":{"max_depth":120,"max_injections":3,"horizon_ms":4000},"search":{"strategy":"bfs","minimal":true,"depth":10,"states_explored":14370,"transitions":21645,"wall_s":0.4323},"assumptions":["ASSUMED bus latency <= 800 ms; messages may be delayed, dropped, duplicated or reordered","ASSUMED BMS FAULT message is edge-triggered and retransmitted every 100 ms until the hub ACKs it; status heartbeat every 2000 ms","ASSUMED hub boot takes 400 ms and clears its RX buffer; only NVM survives a restart","ASSUMED shutdown budget 500 ms (a real number would come from Base's safety requirements)","ASSUMED one dispatch at t=0: DISCHARGE 5000 W, expires at 3000 ms; cloud re-dispatch after a hub restart is not modeled","ASSUMED network_loss means the hub-inverter link is down for the rest of the run","OUT OF SCOPE hardware interlocks (contactors, hardwired BMS trip)","OUT OF SCOPE core-ref is a reference model we wrote, not Base Gen 3 firmware"],"trace":[{"step":0,"t_ms":0,"move":null,"snapshot":{"t_ms":0,"bms":"HEALTHY","bus":"","hub":"ONLINE e1 seq41 DISCHARGE 5000W","inv":"DISCHARGING 5000W seq41 e1","nvm":"e1 next42 seq41 DISCHARGE 5000W e1","hub_bms":"HEALTHY","link":"UP","inv_basis":"HEALTHY","i1_since_ms":null,"i5_since_ms":null,"i4_repeat":null,"injections_left":3},"events":[]},{"step":1,"t_ms":0,"move":{"name":"hub_restart","args":{},"injected":true,"label":"hub_restart"},"snapshot":{"t_ms":0,"bms":"HEALTHY","bus":"","hub":"RESTARTING until 400","inv":"DISCHARGING 5000W seq41 e1","nvm":"e1 next42 seq41 DISCHARGE 5000W e1","hub_bms":"UNKNOWN","link":"UP","inv_basis":"HEALTHY","i1_since_ms":null,"i5_since_ms":null,"i4_repeat":null,"injections_left":2},"events":[{"t_ms":0,"name":"hub_restart","detail":"hub_restart","injected":true}]},{"step":2,"t_ms":50,"move":{"name":"tick","args":{},"injected":false,"label":"tick"},"snapshot":{"t_ms":50,"bms":"HEALTHY","bus":"","hub":"RESTARTING until 400","inv":"DISCHARGING 5000W seq41 e1","nvm":"e1 next42 seq41 DISCHARGE 5000W e1","hub_bms":"UNKNOWN","link":"UP","inv_basis":"HEALTHY","i1_since_ms":null,"i5_since_ms":null,"i4_repeat":null,"injections_left":2},"events":[]},{"step":3,"t_ms":100,"move":{"name":"tick","args":{},"injected":false,"label":"tick"},"snapshot":{"t_ms":100,"bms":"HEALTHY","bus":"","hub":"RESTARTING until 400","inv":"DISCHARGING 5000W seq41 e1","nvm":"e1 next42 seq41 DISCHARGE 5000W e1","hub_bms":"UNKNOWN","link":"UP","inv_basis":"HEALTHY","i1_since_ms":null,"i5_since_ms":null,"i4_repeat":null,"injections_left":2},"events":[]},{"step":4,"t_ms":150,"move":{"name":"tick","args":{},"injected":false,"label":"tick"},"snapshot":{"t_ms":150,"bms":"HEALTHY","bus":"","hub":"RESTARTING until 400","inv":"DISCHARGING 5000W seq41 e1","nvm":"e1 next42 seq41 DISCHARGE 5000W e1","hub_bms":"UNKNOWN","link":"UP","inv_basis":"HEALTHY","i1_since_ms":null,"i5_since_ms":0,"i4_repeat":null,"injections_left":2},"events":[]},{"step":5,"t_ms":200,"move":{"name":"tick","args":{},"injected":false,"label":"tick"},"snapshot":{"t_ms":200,"bms":"HEALTHY","bus":"","hub":"RESTARTING until 400","inv":"DISCHARGING 5000W seq41 e1","nvm":"e1 next42 seq41 DISCHARGE 5000W e1","hub_bms":"UNKNOWN","link":"UP","inv_basis":"HEALTHY","i1_since_ms":null,"i5_since_ms":0,"i4_repeat":null,"injections_left":2},"events":[]},{"step":6,"t_ms":250,"move":{"name":"tick","args":{},"injected":false,"label":"tick"},"snapshot":{"t_ms":250,"bms":"HEALTHY","bus":"","hub":"RESTARTING until 400","inv":"DISCHARGING 5000W seq41 e1","nvm":"e1 next42 seq41 DISCHARGE 5000W e1","hub_bms":"UNKNOWN","link":"UP","inv_basis":"HEALTHY","i1_since_ms":null,"i5_since_ms":0,"i4_repeat":null,"injections_left":2},"events":[]},{"step":7,"t_ms":300,"move":{"name":"tick","args":{},"injected":false,"label":"tick"},"snapshot":{"t_ms":300,"bms":"HEALTHY","bus":"","hub":"RESTARTING until 400","inv":"DISCHARGING 5000W seq41 e1","nvm":"e1 next42 seq41 DISCHARGE 5000W e1","hub_bms":"UNKNOWN","link":"UP","inv_basis":"HEALTHY","i1_since_ms":null,"i5_since_ms":0,"i4_repeat":null,"injections_left":2},"events":[]},{"step":8,"t_ms":350,"move":{"name":"tick","args":{},"injected":false,"label":"tick"},"snapshot":{"t_ms":350,"bms":"HEALTHY","bus":"","hub":"RESTARTING until 400","inv":"DISCHARGING 5000W seq41 e1","nvm":"e1 next42 seq41 DISCHARGE 5000W e1","hub_bms":"UNKNOWN","link":"UP","inv_basis":"HEALTHY","i1_since_ms":null,"i5_since_ms":0,"i4_repeat":null,"injections_left":2},"events":[]},{"step":9,"t_ms":400,"move":{"name":"tick","args":{},"injected":false,"label":"tick"},"snapshot":{"t_ms":400,"bms":"HEALTHY","bus":"cmd@400 hub→inv due 450; cmd@400.2 hub→inv due 450","hub":"ONLINE e2 seq41 DISCHARGE 5000W","inv":"DISCHARGING 5000W seq41 e1","nvm":"e2 next42 seq41 DISCHARGE 5000W e1","hub_bms":"UNKNOWN","link":"UP","inv_basis":"HEALTHY","i1_since_ms":null,"i5_since_ms":0,"i4_repeat":null,"injections_left":2},"events":[{"t_ms":400,"name":"hub_boot","detail":"hub up as ONLINE","injected":false},{"t_ms":400,"name":"send","detail":"cmd@400 CMD hub→inv seq41 DISCHARGE 5000W e1","injected":false},{"t_ms":400,"name":"refresh","detail":"cmd@400.2 CMD hub→inv seq41 DISCHARGE 5000W e1","injected":false}]},{"step":10,"t_ms":450,"move":{"name":"tick","args":{},"injected":false,"label":"tick"},"snapshot":{"t_ms":450,"bms":"HEALTHY","bus":"","hub":"ONLINE e2 seq41 DISCHARGE 5000W","inv":"DISCHARGING 5000W seq41 e1","nvm":"e2 next42 seq41 DISCHARGE 5000W e1","hub_bms":"UNKNOWN","link":"UP","inv_basis":"UNKNOWN","i1_since_ms":null,"i5_since_ms":null,"i4_repeat":null,"injections_left":2},"events":[{"t_ms":450,"name":"deliver","detail":"cmd@400 → inv","injected":false},{"t_ms":450,"name":"deliver","detail":"cmd@400.2 → inv","injected":false}],"violations":["I2"]}],"moves":[{"tick_index":0,"t_ms":0,"move":{"name":"hub_restart","args":{},"injected":true,"label":"hub_restart"}}],"ticks":9,"trace_hash":"sha256:874b1198ab0218b4f27b2a2841082c40b25c861f5e324bd91f89ea618a82cf22","replay":{"command":"fleetflight replay --counterexample cex-6b2a6d1b"}}